{
  "schema": "spec-review-round/v2",
  "review_kind": "recheck",
  "summary": "PASS（仅集中修复精确合同准入）：当前parent SPEC SHA256 b295cb6fc92b22433ee7415c12861a1c8b94fc3e842125d7bc99615d1256c875，candidate 533224f334c43cdb81a344424e420cad93784dd1，198来源binding 6948729b1a99e9411ecad9d2a944355fa0c096df767ca14e736591bf21a03ab2独立实核180原文件对冻结Git逐字节一致+18新路径缺席/0错误。PRE01精确V3路径/59-49-38库存、PRE02真实公共ACP pending turn/start→MCP read→EOF→排空→unknown→同IDthread/read、PRE03精确SRT失败、设置实际route-commit/epoch/一次replace/dirty宿主、DR006 resolve导入新driver封存与PB001 save/request同public投影均有准确可实施合同，无剩余规格阻断。引用同parent后端窄评c2c6d04b...与既有T1097 SPEC822144...仅合同，不重审本人结论。完整报告SHA256 cf678c0edb9abda6ef1005b5900efaad374e140e4cf845ddf3cab55588105d89；actual model unknown/inherited。69原测试仅对应真实首红校准，原下游/strict/owner/CAS/unknown usage/deadline/费用保留；195ENV helper及两历史fixture实际运行仍待，余205新根因需新增精准合同/独评，未授权扫改。当前未record/解冻/改代码或跑模型PGApp；不签implementation/allgreen/官方49/新driver或重新打包，App无授权且AC5未验不得完整complete。",
  "findings": []
}
