{
  "schema": "spec-review-round/v2",
  "review_kind": "initial",
  "summary": "PASS（仅当前SPEC初审）：两测试的过期前置条件有本轮真实RED和当前合同支持。LED048原完整命令实际209PASS/1FAIL，cover首例在建立任何project/contentOutput前直接用output-1创建publication，被原父链所有权校验拒绝；补同user/account真实父链、保原文件修复与好封面断言，并加缺父稿/跨user/跨account零写入负测合理，产品守卫不得改。LED049实际3FAIL/76PASS对应漏创作画布、旧12入口和移除PageScrollArea的断言；T1069稳定Tab容器合同明确保同树只切CSS。固定13标签与href、两侧栏态prefetch=false、双向未保存child/DOM保留和真实浏览器滚动证据足以覆盖该校准。仅shell.test.tsx及cover-file-repair.test.ts写集，shared fixture/运行时代码/配置/预算不变。实施、完整原命令含LED049后段backend、类型/守卫与隔离随包浏览器仍待，不签T1015整体、全Gate、安装、模型或真人微信研究。",
  "findings": []
}
