{
  "schema": "spec-review-round/v2",
  "review_kind": "recheck",
  "summary": "T-1021 来源工程真实分页发现平台 cursor 可跳号、无稳定快照键。T-1020 随之明确本地页序与平台不透明 cursor 的边界、scanPass 重放键、平台报告总数及其来源、完整探测页事实和无快照键的第二次扫描。独立只读复审确认前轮新发现的终止证据缺口已闭合，设计层 PASS。此回执不表示后端事务、平台采集或双账号真机已通过；服务级摘要、探测新键和 partial 夹具仍待实现验证。",
  "findings": []
}
