{
  "schema": "spec-review-round/v2",
  "review_kind": "initial",
  "summary": "独立正式初审 T-1411；审核者为未参与该 SPEC 编写的 /root/t1427_contract_review 子代理，实际模型精确 ID 未核实，不作异构模型声明。绑定当前 SPEC docs/features/t1411-model-probe-auth-parity.md，SHA-256 9f96d971292778c094418199950aaa289ba9e403c381768458618f188b04dc44；适用产品宪法 docs/产品定位.md，SHA-256 86bc2c8add6a01ebf5b2ecf9de05d448770ca14a4e0bdbbf376fffc6387e3800。已读任务包 §1–5、§7–9，并在写评审证据前核对 §6；核对产品宪法全文、当前 AGENTS 约束、SYSTEM_ARCHITECTURE 和相关真实源码/测试配置。\n\n未发现阻碍实施的实质规格缺口。静态源码证据确认两处既有缺陷：contract/src/internal/model-probe-io.ts 的文本 strict schema 未声明 authStyle；backend/src/modules/ai-runtime/model-probe-io.service.ts 的 probeText 解构及请求投影未转发 authStyle。frontend 已解析该字段，ai-worker/src/io/model-probe-worker-entry.ts 将已解析 spec 直接交给 modelFor，provider-factory.ts 的 ApiModelSpec 已含可选 authStyle，pi-provider.ts 已在 Anthropic bearer 时关闭 apiKey 并提供 Authorization；当前已安装 Pi Anthropic createClient 支持此 header-owned auth。因此指定三处产品写集足以保留解析鉴权方式并修正文案，无需新增 worker 生产路径或修改公开 operation/schema。可选字段与既有 provider 缺省相容；非法枚举由内部 strict schema 拒绝；图片路径保持原契约。\n\n已实际阅读 request-io.service.ts 的输入解析、fork/IPC、错误重建、取消与 stop，以及 settings-model-test-wrap.test.ts 的真实 worker-entry 临时打包、Pi 初始化插件、loopback HTTP 和支付诊断测试。backend 的 src/**/*.test.ts 与 frontend 的 src/**/*.{test,spec}.{ts,tsx} 收集规则覆盖指定测试写集；既有 backend 集成测试已有从 ai-worker 加载 esbuild 与 Pi bundling 插件的方式，故无需扩 package 写集。合同要求原代码先执行真实 worker/IPC/HTTP 红测，再同组转绿，并验证 bearer 无 x-api-key、显式 x-api-key、缺省、一次请求、128 上限、非法值和 secret 不外泄，能覆盖该确定字段丢失缺陷；保留现有真实 IPC 支付诊断覆盖也防止本次修复吞掉此前安全提示。\n\n成功提示明确只证明最小请求收到流式回复，与产品宪法 P-03、R-SETTINGS、NFR-PRIVACY、R-COPILOT 的真实结果和 secret 边界相容。合同禁止配置、钱包、聊天预算与 fallback 改动，不扩大出网权限，也未把轻量探针冒充完整对话。此评审仅确认规格及可执行测试入口，未运行红绿测试、未验证实现或安装产物、未调用真实业务；官方 402 根因、完整官方聊天、记忆、工具和原任务恢复仍须在 T1427 单独形成真实证据，本轮不关闭这些验收。",
  "findings": []
}
