{
  "schema": "spec-review-round/v2",
  "review_kind": "recheck",
  "summary": "独立只读评审creator_spec_review已审阅更新后完整T-1072 SPEC、DEC-T1072-LDR-REFERENCE及上一轮packet。Growth连接registrationRef仅明确为^LDR_[0-9a-f]{32}$，创建/journal绑定/恢复/ACK保持同一精确引用；Activity registeredDeviceRef与jti继续严格26位Crockford ULID，不接受任意字符串、URL或无真实历史对象的ULID连接兼容。未发现新增规格矛盾或blocker/major。未运行HTTP或回归，不替代真实双机验收。",
  "findings": []
}
